{
  "schema_version": 1,
  "candidate_id": "blk-b57102d664a768a8",
  "ownership": "dedicated_third_party",
  "purpose": "analytics",
  "classifier": "HCloudLab assisted evidence review",
  "classified_at": "2026-09-18",
  "evidence": [
    "https://help.ensighten.com/hc/en-us/articles/36258326811665-Implementation-with-Google-Tag-Manager"
  ],
  "reason": "Ensighten's official help documentation instructs customers using its beacon/pixel-based server-side tagging solution to allow script requests to nexus.ensighten.com. The rule targets only that documented tag-management endpoint."
}
