{
  "schema_version": 1,
  "candidate_id": "blk-8600f83dcc5ad331",
  "ownership": "dedicated_third_party",
  "purpose": "analytics",
  "classifier": "HCloudLab assisted evidence review",
  "classified_at": "2026-09-18",
  "evidence": [
    "https://tenjin.com/docs/callback-macros/",
    "https://tenjin.com/privacy/"
  ],
  "reason": "Tenjin's own documentation uses track.tenjin.io as the server for attribution tracking links, including advertising identifiers and campaign parameters. Exact-host blocking is limited to that documented tracking endpoint."
}
