{
  "schema_version": 1,
  "candidate_id": "blk-2b23a84a2c131be6",
  "ownership": "dedicated_third_party",
  "purpose": "analytics",
  "classifier": "HCloudLab assisted evidence review",
  "classified_at": "2026-09-18",
  "evidence": [
    "https://www.help.adjust.com/en/article/links",
    "https://www.help.adjust.com/en/article/append-advertising-identifiers"
  ],
  "reason": "Adjust is a dedicated third-party attribution/measurement platform; app.adjust.com is documented as its link/attribution endpoint."
}
